{
  "artifacts": {
    "events_jsonl": "events.jsonl",
    "save_json": "save.json"
  },
  "checks": {
    "corrupt_save_state_isolation": true,
    "duplicate_idempotent": true,
    "early_forbidden_state_isolation": true,
    "expected_terminal_hash_match": true,
    "fixture_expectations_match": true,
    "permitted_hint_after_authorization": true,
    "replay_hash_match": true,
    "research_oracle_hash_match": true,
    "save_load_hash_match": true,
    "timeout_state_isolation": true
  },
  "counts": {
    "commits": 3,
    "duplicate_events": 0,
    "events": 21,
    "fallbacks": 1,
    "timeouts": 0
  },
  "engine": {
    "headless": true,
    "name": "Godot",
    "version": "4.7.1-stable (official)"
  },
  "episode_id": "sealed-lighthouse-episode-001",
  "execution_status": "OBSERVED_ENGINE_RUN",
  "fixture_id": "sealed-lighthouse-canonical-v1",
  "hash_algorithm": "sha256-canonical-json-v1",
  "initial_state_hash": "f488d9c4202a63bd1826fe57e0583f492abacd6893e1c7db24b5a940c5e7812c",
  "loaded_state_hash": "4b2310173dc059071fdc98e7705608d383dda81559706c3dd33bc96983108892",
  "replay_state_hash": "4b2310173dc059071fdc98e7705608d383dda81559706c3dd33bc96983108892",
  "research_oracle_state_hash": "4b2310173dc059071fdc98e7705608d383dda81559706c3dd33bc96983108892",
  "run_id": "godot-headless-canonical-v1",
  "scenario_id": "sealed-lighthouse-v1",
  "schema_version": "1.0.0",
  "seed": 23,
  "software": {
    "canonicalizer_sha256": "6a4eb4693e0c34c24399e2d23ace4aceebb45fe9eb54e410bb25708232e88a58",
    "fixture_sha256": "c1749c8d9c9e141382f6da68be843d6802c83c862f8ff7d9994cc52d530bb460",
    "machine_sha256": "5d5cffb4335378e7130dae8a994908111757a33a2ed46f0a4066f6674e4dd8b7",
    "runner_sha256": "acde3de4c5680f8189c72b70aace28ea1e5d304b6d793d0920dd78317e3fd16c",
    "scenario_sha256": "f262455e57be7204f5f597736a89379f37f3f698475fa745a48be6ef2ebb28d9"
  },
  "telemetry": {
    "clock": "Time.get_ticks_usec",
    "engine_elapsed_ms": 20.896,
    "frame_budget_ms": 16.7,
    "frame_budget_passed": false,
    "headless_frame_delta_ms": [
      142.739333333333,
      7.26066666666667,
      2.77733333333333,
      0.81,
      13.0793333333333
    ],
    "p95_frame_delta_ms": 142.739333333333,
    "p95_request_latency_ms": 0.164,
    "request_budget_ms": 100.0,
    "request_budget_passed": true,
    "request_latency_ms": [
      0.139,
      0.005,
      0.082,
      0.164
    ]
  },
  "terminal_state_hash": "4b2310173dc059071fdc98e7705608d383dda81559706c3dd33bc96983108892"
}
